{
  "contract_version": "1.0",
  "gateway_id": "11111111-1111-4111-8111-111111111111",
  "batch_id": "44444444-4444-4444-8444-444444444444",
  "results": [
    {
      "message_id": "55555555-5555-4555-8555-555555555552",
      "sample_id": "aaaaaaaa-aaaa-4aaa-8aaa-aaaaaaaaaaa1",
      "outcome": "recorded_current",
      "received_at": "2026-07-30T12:01:00.125Z"
    },
    {
      "message_id": "55555555-5555-4555-8555-555555555553",
      "sample_id": "aaaaaaaa-aaaa-4aaa-8aaa-aaaaaaaaaaa2",
      "outcome": "duplicate",
      "received_at": "2026-07-30T12:01:00.126Z"
    }
  ]
}
